{
  "id": "statistical-power",
  "ja": {
    "term": "検出力",
    "reading": "けんしゅつりょく",
    "alt": []
  },
  "en": {
    "term": "power of the test",
    "alt": [
      "power of a test",
      "statistical power"
    ],
    "uk": null
  },
  "pos": "noun",
  "mapping": "exact",
  "mapping_note": null,
  "domains": [
    "statistics"
  ],
  "level": {
    "jp": [
      "大学"
    ],
    "us": [
      "AP Statistics",
      "Intro Statistics"
    ]
  },
  "definition_ja": "対立仮説が正しいときに、帰無仮説を正しく棄却する確率。1 から第二種の過誤の確率を引いた値。",
  "definition_en": "The probability that a test correctly rejects the null hypothesis when the alternative is true; 1 minus the probability of a Type II error.",
  "latex": "\\text{power} = 1 - \\beta",
  "spoken_en": null,
  "examples": [
    {
      "en": "A bigger sample gives the test more power to detect a real difference.",
      "ja": "標本を大きくすると、本当の差を見つける検出力が上がる。",
      "register": "spoken"
    },
    {
      "en": "Explain how increasing the significance level affects the power of the test.",
      "ja": "有意水準を大きくすると検出力がどう変わるか説明せよ。",
      "register": "written"
    }
  ],
  "collocations": [],
  "pitfalls": [
    "OpenStax Introductory Statistics は power of the test を単に power とも書く（a high power）。累乗の power と同じ語。"
  ],
  "related": [
    "type-ii-error",
    "type-i-error",
    "significance-level",
    "hypothesis-testing"
  ],
  "sources": [
    {
      "type": "textbook",
      "title": "OpenStax Introductory Statistics 2e"
    }
  ],
  "confidence": "likely",
  "reviewed": {
    "machine": "2026-09-25",
    "audit": null,
    "human": null
  },
  "updated": "2026-09-26",
  "evidence": {
    "spoken": {
      "power of the test": 2
    },
    "written": {
      "power of the test": 5,
      "power of a test": 2
    },
    "sources": [
      "khan-ap-stats",
      "openstax-introstats",
      "yt:organicchem"
    ],
    "counted": "2026-09-25"
  },
  "flags": [
    {
      "code": "corpus-reference-fallback",
      "note": "コーパスで決まらない（話: 判断不能: 重み付け後 2 件（10 未満） ／ 書: 判断不能: 重み付け後 7 件（10 未満））。見出しは OpenStax の呼び方 power of the test（本文 5 件）。register は主張しない。",
      "raised": "2026-09-25"
    }
  ]
}
