{
  "id": "product-rule",
  "ja": {
    "term": "積の微分",
    "reading": "せきのびぶん",
    "alt": [
      "積の微分法"
    ]
  },
  "en": {
    "term": "product rule",
    "alt": [],
    "uk": null,
    "register": "both"
  },
  "pos": "noun",
  "mapping": "exact",
  "mapping_note": null,
  "domains": [
    "calculus"
  ],
  "level": {
    "jp": [
      "数III"
    ],
    "us": [
      "AP Calculus AB",
      "Calculus I"
    ]
  },
  "definition_ja": "積の導関数 {f(x)g(x)}′ = f′(x)g(x) + f(x)g′(x) を与える公式。",
  "definition_en": "The rule (fg)′ = f′g + fg′ for the derivative of a product.",
  "latex": "(fg)' = f'g + fg'",
  "spoken_en": "the derivative of f g is f prime g plus f g prime",
  "examples": [
    {
      "en": "Use the product rule: take the derivative of the first factor times the second, then add the first factor times the derivative of the second.",
      "ja": "積の微分を使う。前を微分して後ろはそのまま、足すことの、前はそのままで後ろを微分。",
      "register": "spoken"
    },
    {
      "en": "Use the product rule to differentiate y = x² sin x.",
      "ja": "積の微分を用いて y = x² sin x を微分せよ。",
      "register": "written"
    }
  ],
  "collocations": [
    {
      "en": "use the product rule",
      "ja": "積の微分を使う"
    }
  ],
  "pitfalls": [
    "対数の性質にも product rule（log MN = log M + log N）があり、用例コーパスの件数にはその意味も含まれる。"
  ],
  "related": [
    "quotient-rule",
    "chain-rule",
    "derivative-of-a-sum"
  ],
  "sources": [
    {
      "type": "wikipedia-langlink",
      "ja": "積の微分法則",
      "en": "Product rule"
    },
    {
      "type": "textbook",
      "title": "OpenStax Calculus Volume 1"
    },
    {
      "type": "reference",
      "title": "College Board, AP Calculus AB and BC Course and Exam Description (Effective Fall 2020)",
      "url": "https://apcentral.collegeboard.org/media/pdf/ap-calculus-ab-and-bc-course-and-exam-description.pdf",
      "note": "Topic 2.8（product rule）"
    }
  ],
  "confidence": "verified",
  "reviewed": {
    "machine": "2026-09-24",
    "audit": "2026-09-26",
    "human": null
  },
  "updated": "2026-09-26",
  "evidence": {
    "spoken": {
      "product rule": 346
    },
    "written": {
      "product rule": 165
    },
    "sources": [
      "khan-ap-calc",
      "mit-18.01",
      "mit-18.02",
      "mit-18.03",
      "mit-6.042",
      "mit-notes",
      "openstax-algtrig",
      "openstax-calculus",
      "yt:3blue1brown",
      "yt:blackpenredpen",
      "yt:nancypi",
      "yt:organicchem",
      "yt:patrickjmt",
      "yt:profleonard"
    ],
    "counted": "2026-09-26"
  }
}
