{
  "id": "perpendicular-bisector",
  "ja": {
    "term": "垂直二等分線",
    "reading": "すいちょくにとうぶんせん",
    "alt": []
  },
  "en": {
    "term": "perpendicular bisector",
    "alt": [],
    "uk": null
  },
  "pos": "noun",
  "mapping": "exact",
  "mapping_note": null,
  "domains": [
    "geometry"
  ],
  "level": {
    "jp": [
      "中1",
      "数II"
    ],
    "us": [
      "Geometry",
      "Precalculus"
    ]
  },
  "definition_ja": "線分の中点を通り、その線分に垂直な直線。線分の両端から等しい距離にある点の集まりになる。",
  "definition_en": "The line through the midpoint of a segment and perpendicular to it; every point on it is equally far from the two endpoints.",
  "latex": null,
  "spoken_en": null,
  "examples": [
    {
      "en": "Any point on the perpendicular bisector is the same distance from A and from B.",
      "ja": "垂直二等分線上の点は、A からも B からも同じ距離にある。",
      "register": "spoken"
    },
    {
      "en": "Find the equation of the perpendicular bisector of the segment joining A(1, 2) and B(5, 4).",
      "ja": "2 点 A(1, 2), B(5, 4) を結ぶ線分の垂直二等分線の方程式を求めよ。",
      "register": "written"
    }
  ],
  "collocations": [],
  "pitfalls": [
    "用例コーパスでは話し言葉 5 件・書き言葉 1 件と少ない（OpenStax Algebra and Trigonometry に 1 件）。"
  ],
  "related": [
    "midpoint",
    "equation-of-a-line",
    "perpendicular-lines"
  ],
  "sources": [
    {
      "type": "wikipedia-langlink",
      "ja": "二等分線",
      "en": "Bisection"
    },
    {
      "type": "textbook",
      "title": "OpenStax Algebra and Trigonometry 2e"
    }
  ],
  "confidence": "likely",
  "reviewed": {
    "machine": "2026-09-24",
    "audit": null,
    "human": null
  },
  "updated": "2026-09-24",
  "evidence": {
    "spoken": {
      "perpendicular bisector": 5
    },
    "written": {
      "perpendicular bisector": 1
    },
    "sources": [
      "openstax-algtrig",
      "yt:organicchem"
    ],
    "counted": "2026-09-24"
  },
  "flags": [
    {
      "code": "corpus-reference-fallback",
      "note": "コーパスで決まらない（話: 判断不能: 重み付け後 5 件（10 未満） ／ 書: 判断不能: 重み付け後 1 件（10 未満））。見出しは OpenStax の呼び方 perpendicular bisector（本文 1 件）。register は主張しない。",
      "raised": "2026-09-24"
    }
  ]
}
