{
  "id": "integral",
  "ja": {
    "term": "インテグラル",
    "reading": "いんてぐらる",
    "alt": []
  },
  "en": {
    "term": "integral",
    "alt": [],
    "uk": null,
    "register": "both"
  },
  "pos": "noun",
  "mapping": "near",
  "mapping_note": "日本語版 Wikipedia「積分記号」は、記号 ∫ を「積分記号」または単に「インテグラル」と呼び、口頭では「インテグラル」と読み、「積分する」と説明することもあると書く。英語の integral は積分の式やその値そのものを指す名詞（the integral of x² from 0 to 1）で、記号 ∫ だけを指すときは integral sign と言う。",
  "domains": [
    "calculus",
    "notation"
  ],
  "level": {
    "jp": [
      "数II",
      "数III"
    ],
    "us": [
      "AP Calculus AB",
      "Calculus I"
    ]
  },
  "definition_ja": "積分記号 ∫ の読み方。英語の integral は、積分の式やその値そのものを指す。",
  "definition_en": "An expression such as ∫ f(x) dx, or its value; the symbol ∫ by itself is the integral sign.",
  "latex": "\\int_0^1 x^2\\,dx",
  "spoken_en": "the integral from zero to one of x squared dx",
  "respelling": "IN-tuh-grul",
  "examples": [
    {
      "en": "This integral looks nasty, but a substitution cleans it up.",
      "ja": "この積分は面倒そうに見えるけど、置換すればすっきりする。",
      "register": "spoken"
    },
    {
      "en": "The integral ∫₀¹ x² dx equals 1/3.",
      "ja": "∫₀¹ x² dx の値は 1/3 である。",
      "register": "written"
    }
  ],
  "collocations": [
    {
      "en": "the integral sign",
      "ja": "積分記号 ∫"
    }
  ],
  "pitfalls": [
    "形容詞の integral には「整数の」の意味もある（integral coefficients ＝ 整数係数）。",
    "発音は第 1 音節に強勢を置く読みのほかに、第 2 音節に置く読みもある。"
  ],
  "related": [
    "integration",
    "integrate",
    "definite-integral",
    "indefinite-integral"
  ],
  "sources": [
    {
      "type": "textbook",
      "title": "OpenStax Calculus Volume 1"
    },
    {
      "type": "reference",
      "title": "日本語版 Wikipedia「積分記号」",
      "url": "https://ja.wikipedia.org/wiki/%E7%A9%8D%E5%88%86%E8%A8%98%E5%8F%B7",
      "note": "呼び方: 積分記号、インテグラル"
    }
  ],
  "confidence": "verified",
  "reviewed": {
    "machine": "2026-09-24",
    "audit": "2026-09-26",
    "human": null
  },
  "updated": "2026-09-26",
  "evidence": {
    "spoken": {
      "integral": 3922,
      "the integral sign": 14
    },
    "written": {
      "integral": 2366,
      "the integral sign": 3
    },
    "sources": [
      "khan-ap-calc",
      "mit-18.01",
      "mit-18.02",
      "mit-18.03",
      "mit-18.06",
      "mit-6.042",
      "mit-notes",
      "openstax-algtrig",
      "openstax-calculus",
      "openstax-introstats",
      "openstax-precalculus",
      "yt:3blue1brown",
      "yt:blackpenredpen",
      "yt:nancypi",
      "yt:organicchem",
      "yt:patrickjmt",
      "yt:profleonard"
    ],
    "counted": "2026-09-25"
  }
}
