{
  "id": "necessary-and-sufficient-condition",
  "ja": {
    "term": "必要十分条件",
    "reading": "ひつようじゅうぶんじょうけん",
    "alt": []
  },
  "en": {
    "term": "if and only if",
    "alt": [
      "necessary and sufficient condition"
    ],
    "uk": null,
    "variants": [
      {
        "term": "iff",
        "register": "written",
        "note": "if and only if の略記で、書き言葉（証明・講義ノート）で使う。読むときは if and only if と言う。話し言葉にはほとんど出てこず、書き言葉ではすべて MIT の講義ノート。"
      }
    ],
    "register": "both"
  },
  "pos": "noun",
  "mapping": "near",
  "mapping_note": "英語では名詞の「必要十分条件」よりも、接続の言い方 p if and only if q（p ⇔ q）で述べる。「A であるための必要十分条件は B である」は A if and only if B。用例コーパスでは if and only if が話し言葉・書き言葉ともよく出てくるのに対し、名詞の necessary and sufficient condition は書き言葉（MIT の講義ノート）にわずかにあるだけ。",
  "domains": [
    "logic"
  ],
  "level": {
    "jp": [
      "数I"
    ],
    "us": [
      "Geometry",
      "Discrete Math"
    ]
  },
  "definition_ja": "p ⇒ q と q ⇒ p がともに真のとき、q を p であるための必要十分条件という。このとき p と q は同値である。",
  "definition_en": "q is a necessary and sufficient condition for p when p implies q and q implies p; in other words, p holds if and only if q holds.",
  "latex": "p \\iff q",
  "spoken_en": "p if and only if q",
  "examples": [
    {
      "en": "A number is divisible by 3 if and only if the sum of its digits is divisible by 3.",
      "ja": "整数が 3 で割り切れるための必要十分条件は、各位の数の和が 3 で割り切れることである。",
      "register": "written"
    },
    {
      "en": "\"If and only if\" means you have to prove both directions: this one implies that one, and that one implies this one.",
      "ja": "「必要十分」ということは両方向を示さないといけない。こっちからあっち、あっちからこっち。",
      "register": "spoken"
    },
    {
      "en": "Prove that n² is odd iff n is odd.",
      "ja": "n² が奇数であることは、n が奇数であるための必要十分条件であることを証明せよ。",
      "register": "written"
    }
  ],
  "collocations": [],
  "pitfalls": [
    "必要十分条件を示すには、⇒ と ⇐ の両方向を証明する。英語では「両方向」を both directions と言える。",
    "iff は書くときの略記。口で読むときは if and only if。"
  ],
  "related": [
    "necessary-condition",
    "sufficient-condition",
    "equivalent",
    "condition",
    "proposition"
  ],
  "sources": [
    {
      "type": "textbook",
      "title": "OpenStax Calculus Volume 1"
    },
    {
      "type": "textbook",
      "title": "OpenStax Algebra and Trigonometry 2e"
    }
  ],
  "confidence": "verified",
  "reviewed": {
    "machine": "2026-09-25",
    "audit": "2026-09-27",
    "human": null
  },
  "updated": "2026-09-27",
  "evidence": {
    "spoken": {
      "if and only if": 76,
      "iff": 2
    },
    "written": {
      "if and only if": 114,
      "iff": 84,
      "necessary and sufficient condition": 1
    },
    "sources": [
      "khan-algebra",
      "khan-ap-calc",
      "khan-middle",
      "mit-18.01",
      "mit-18.02",
      "mit-18.03",
      "mit-6.042",
      "mit-notes",
      "openstax-algtrig",
      "openstax-calculus",
      "openstax-intalg",
      "openstax-precalculus",
      "yt:profleonard"
    ],
    "counted": "2026-09-26"
  }
}
