{
  "id": "differential",
  "ja": {
    "term": "微分 dy",
    "reading": "びぶんでぃーわい",
    "alt": []
  },
  "en": {
    "term": "differential",
    "alt": [],
    "uk": null,
    "register": "both"
  },
  "pos": "noun",
  "mapping": "exact",
  "mapping_note": null,
  "domains": [
    "calculus"
  ],
  "level": {
    "jp": [
      "数III"
    ],
    "us": [
      "Calculus I"
    ]
  },
  "definition_ja": "dy = f′(x) dx で定める量 dy（と dx）。Δy の近似に使う。",
  "definition_en": "The quantity dy = f′(x) dx (together with dx), used to approximate Δy.",
  "latex": "dy = f'(x)\\,dx",
  "spoken_en": "d y equals f prime of x d x",
  "examples": [
    {
      "en": "The differential dy is f prime of x times dx.",
      "ja": "微分 dy は f′(x) に dx を掛けたもの。",
      "register": "spoken"
    },
    {
      "en": "Find the differential dy for y = x² and evaluate it when x = 3 and dx = 0.1.",
      "ja": "y = x² の微分 dy を求め、x = 3、dx = 0.1 のときの値を求めよ。",
      "register": "written"
    }
  ],
  "collocations": [],
  "pitfalls": [],
  "related": [
    "linear-approximation",
    "small-change",
    "leibniz-notation",
    "total-differential"
  ],
  "sources": [
    {
      "type": "textbook",
      "title": "OpenStax Calculus Volume 1"
    }
  ],
  "confidence": "verified",
  "reviewed": {
    "machine": "2026-09-24",
    "audit": "2026-09-26",
    "human": null
  },
  "updated": "2026-09-26",
  "evidence": {
    "spoken": {
      "differential !equation !equations": 273
    },
    "written": {
      "differential !equation !equations": 94
    },
    "sources": [
      "khan-ap-calc",
      "khan-middle",
      "mit-18.01",
      "mit-18.02",
      "mit-18.03",
      "mit-18.06",
      "mit-notes",
      "openstax-algtrig",
      "openstax-calculus",
      "yt:3blue1brown",
      "yt:blackpenredpen",
      "yt:nancypi",
      "yt:patrickjmt",
      "yt:profleonard"
    ],
    "counted": "2026-09-26"
  }
}
