{
  "id": "conditions-that-determine-a-triangle",
  "ja": {
    "term": "三角形の決定条件",
    "reading": "さんかくけいのけっていじょうけん",
    "alt": []
  },
  "en": {
    "term": "determine a unique triangle",
    "alt": [
      "conditions that determine a triangle"
    ],
    "uk": null
  },
  "pos": "phrase",
  "mapping": "near",
  "mapping_note": "名詞の「決定条件」に当たる語は用例コーパスと参照に出てこない。IM Grade 7（7.9・7.10 Drawing Triangles）は「どの測定値の組が三角形をただ 1 つに決めるか」を determine one unique triangle と言い、IM Geometry（2.4・2.11・2.12）は define a unique triangle と言う。IM Geometry・CK-12 Geometry は同じ事実を合同条件 SSS・SAS・ASA として扱う。高等学校学習指導要領解説（数学I）は正弦定理・余弦定理を三角形の決定条件と関連付けて理解すると書き、中学校学習指導要領解説（第 2 学年）は合同条件を三角形の決定条件を基に認めると書く。",
  "domains": [
    "trigonometry"
  ],
  "level": {
    "jp": [
      "中2",
      "数I"
    ],
    "us": [
      "Geometry",
      "Precalculus"
    ]
  },
  "definition_ja": "三角形の形と大きさがただ 1 つに決まるための条件。3 辺の長さ、2 辺とその間の角、1 辺とその両端の角のいずれかが分かればよい。",
  "definition_en": "The sets of given parts that fix a triangle's shape and size uniquely: three sides, two sides and the included angle, or one side and the two angles at its ends.",
  "latex": null,
  "spoken_en": null,
  "examples": [
    {
      "en": "So what are the conditions that determine a triangle? Three sides, two sides and the angle between them, or one side and the two angles on its ends.",
      "ja": "では、三角形の決定条件は何だろう。3 辺、2 辺とその間の角、1 辺とその両端の角だ。",
      "register": "spoken"
    },
    {
      "en": "State the conditions that determine a triangle, and explain why two sides and a non-included angle are not enough.",
      "ja": "三角形の決定条件を述べ、2 辺とその間にない角では足りない理由を説明せよ。",
      "register": "written"
    },
    {
      "en": "Which of the given sets of measurements determine a unique triangle?",
      "ja": "与えられた測定値の組のうち、三角形がただ 1 つに決まるのはどれか。",
      "register": "written"
    }
  ],
  "collocations": [],
  "pitfalls": [
    "2 辺とその間にない角（SSA）では、三角形が 2 通りできることがある（正弦定理の ambiguous case）。決定条件にも合同条件にも入らない。",
    "3 つの角（AAA）だけでは大きさが決まらず、相似な三角形しか決まらない。"
  ],
  "related": [
    "triangle",
    "congruent",
    "similar-triangles",
    "law-of-sines",
    "law-of-cosines",
    "congruence-criteria"
  ],
  "sources": [
    {
      "type": "reference",
      "title": "Illustrative Mathematics, IM 6–8 Math (Grade 7)",
      "url": "https://im.kendallhunt.com/MS/students/2/index.html",
      "note": "7.9・7.10 Drawing Triangles: determine one unique triangle（3 件）、unique triangle（10 件）"
    },
    {
      "type": "reference",
      "title": "Illustrative Mathematics, IM 9–12 Math (Geometry)",
      "url": "https://im.kendallhunt.com/HS/students/2/index.html",
      "note": "2.4・2.11・2.12: define a unique triangle（4 件）"
    },
    {
      "type": "reference",
      "title": "高等学校学習指導要領（平成30年告示）解説 数学編 理数編",
      "url": "https://www.mext.go.jp/content/20260115-mxt_kyoiku02-100002620_04.pdf",
      "note": "数学I 図形と計量: 正弦定理や余弦定理について三角形の決定条件や三平方の定理と関連付けて理解（4 件）"
    },
    {
      "type": "reference",
      "title": "中学校学習指導要領（平成29年告示）解説 数学編",
      "url": "https://www.mext.go.jp/component/a_menu/education/micro_detail/__icsFiles/afieldfile/2019/03/18/1387018_004.pdf",
      "note": "第 2 学年 図形: 合同条件を三角形の決定条件を基に認める（1 件）"
    }
  ],
  "confidence": "likely",
  "reviewed": {
    "machine": "2026-09-25",
    "audit": null,
    "human": null
  },
  "updated": "2026-09-26",
  "evidence": {
    "sources": [],
    "counted": "2026-09-26"
  },
  "flags": [
    {
      "code": "corpus-reference-fallback",
      "note": "コーパスで決まらない（話: 判断不能: 重み付け後 0 件（10 未満） ／ 書: 判断不能: 重み付け後 0 件（10 未満））。見出しは IM の呼び方 determine a unique triangle | determine one unique triangle | define a unique triangle（Geometry 2.11 Side-Side-Angle (Sometimes) Congruence・Grade 7 7.9 Drawing Triangles (Part 1)・Grade 7 7.10 Drawing Triangles (Part 2)・計 4 件）。register は主張しない。",
      "raised": "2026-09-26"
    }
  ]
}
