{
  "id": "comparison-for-divergence",
  "ja": {
    "term": "追い出しの原理",
    "reading": "おいだしのげんり",
    "alt": []
  },
  "en": {
    "term": "comparison for divergence",
    "alt": [],
    "uk": null
  },
  "pos": "noun",
  "mapping": "none",
  "mapping_note": "用例コーパスと参照（CED・OpenStax・IM・CK-12）には決まった言い方が出てこない。数列の「aₙ ≧ bₙ で bₙ → ∞ なら aₙ → ∞」という性質は、参照に名前も定理の形も出てこない（同じ比較を、OpenStax Calculus Volume 2 は広義積分で A Comparison Theorem（3.7）、級数で Comparison Test（5.4）として示し、AP の CED（topic 10.6）も級数の comparison test を扱う）。数列で書くときは Since aₙ ≥ bₙ and bₙ → ∞, aₙ → ∞ as well. と理由を文で書く。見出しの英語は本プロジェクトの説明的な訳。日本語の「追い出しの原理」は大学受験で使われる名前（日本語版 Wikipedia「はさみうちの原理」）。",
  "domains": [
    "calculus",
    "analysis"
  ],
  "level": {
    "jp": [
      "数III"
    ],
    "us": []
  },
  "definition_ja": "すべての n で aₙ ≧ bₙ であり、bₙ が正の無限大に発散するなら、aₙ も正の無限大に発散するという性質。",
  "definition_en": "The property that if aₙ ≥ bₙ for every n and bₙ → ∞, then aₙ → ∞ as well.",
  "latex": null,
  "spoken_en": null,
  "examples": [
    {
      "en": "Since a sub n is always bigger than n, and n goes to infinity, a sub n goes to infinity too.",
      "ja": "aₙ はいつも n より大きく、n が正の無限大に発散するので、aₙ も発散する。",
      "register": "spoken"
    },
    {
      "en": "Since 2ⁿ ≥ n for all n ≥ 1 and n → ∞, it follows that 2ⁿ → ∞.",
      "ja": "n ≧ 1 のとき 2ⁿ ≧ n であり n → ∞ なので、2ⁿ → ∞ である。",
      "register": "written"
    }
  ],
  "collocations": [],
  "pitfalls": [],
  "related": [
    "squeeze-theorem",
    "diverge-to-positive-infinity"
  ],
  "sources": [
    {
      "type": "editorial"
    },
    {
      "type": "reference",
      "title": "日本語版 Wikipedia「はさみうちの原理」",
      "url": "https://ja.wikipedia.org/wiki/%E3%81%AF%E3%81%95%E3%81%BF%E3%81%86%E3%81%A1%E3%81%AE%E5%8E%9F%E7%90%86",
      "note": "追い出しの原理（日本の大学受験で使われる名前）"
    },
    {
      "type": "textbook",
      "title": "OpenStax Calculus Volume 2",
      "note": "3.7 Improper Integrals（A Comparison Theorem）・5.4 Comparison Tests（Comparison Test。mapping_note）"
    },
    {
      "type": "reference",
      "title": "College Board, AP Calculus AB and BC Course and Exam Description (Effective Fall 2020)",
      "url": "https://apcentral.collegeboard.org/media/pdf/ap-calculus-ab-and-bc-course-and-exam-description.pdf",
      "note": "Topic 10.6（comparison test。mapping_note）"
    }
  ],
  "confidence": "verified",
  "reviewed": {
    "machine": "2026-09-24",
    "audit": "2026-09-26",
    "human": null
  },
  "updated": "2026-10-09",
  "evidence": {
    "sources": [],
    "counted": "2026-09-26"
  },
  "flags": [
    {
      "code": "corpus-no-fixed-expression",
      "note": "用例コーパスと参照（CED・OpenStax・IM・CK-12）には決まった言い方が出てこない（話 0 件 ／ 書 0 件）。mapping none なので、決まった言い方が出てこないと判定した（英語版 Wikipedia の数学記事の記事名にも候補が無い）。register は主張しない。人間レビューには回さない。",
      "raised": "2026-09-26"
    }
  ]
}
