{
  "id": "cauchy-schwarz-inequality",
  "ja": {
    "term": "コーシー・シュワルツの不等式",
    "reading": "こーしー・しゅわるつのふとうしき",
    "alt": [
      "コーシー＝シュワルツの不等式"
    ]
  },
  "en": {
    "term": "Cauchy-Schwarz inequality",
    "alt": [],
    "uk": null
  },
  "pos": "noun",
  "mapping": "exact",
  "mapping_note": "米国の高校課程（CED・OpenStax・IM・CK-12）では扱わない（CED・OpenStax・IM・CK-12 にも用例コーパスにも出てこない）。",
  "domains": [
    "algebra"
  ],
  "level": {
    "jp": [
      "大学"
    ],
    "us": [
      "Linear Algebra"
    ]
  },
  "definition_ja": "(a² + b²)(x² + y²) ≧ (ax + by)² のように、2 組の実数について「平方の和の積」が「積の和の平方」以上になるという不等式。",
  "definition_en": "The inequality stating that the product of two sums of squares is at least the square of the sum of products, e.g. (a² + b²)(x² + y²) ≥ (ax + by)².",
  "latex": "(a^2 + b^2)(x^2 + y^2) \\ge (ax + by)^2",
  "spoken_en": "a squared plus b squared, times x squared plus y squared, is greater than or equal to a x plus b y, squared",
  "examples": [
    {
      "en": "The Cauchy-Schwarz inequality is really about the dot product: u dot v is at most the length of u times the length of v.",
      "ja": "コーシー・シュワルツの不等式は実は内積の話で、u·v は |u||v| 以下になる。",
      "register": "spoken"
    },
    {
      "en": "Prove that (a² + b²)(x² + y²) ≥ (ax + by)², and state when equality holds.",
      "ja": "(a² + b²)(x² + y²) ≧ (ax + by)² を証明し、等号が成り立つ場合を答えよ。",
      "register": "written"
    }
  ],
  "collocations": [],
  "pitfalls": [
    "用例コーパス（OpenStax 9 冊を含む）には出てこない。Nicholson（Linear Algebra with Applications）は、Rⁿ の |x · y| ≤ ‖x‖‖y‖ を Cauchy inequality（Theorem 5.3.2）、内積空間の形を Cauchy-Schwarz inequality（Theorem 10.1.4）と呼ぶ。OpenStax Calculus Volume 3（2.3 The Dot Product）は u · v = ‖u‖‖v‖ cos θ を扱うが、この不等式は書かない。"
  ],
  "related": [
    "am-gm-inequality",
    "prove",
    "triangle-inequality",
    "dot-product",
    "equality-holds"
  ],
  "sources": [
    {
      "type": "wikipedia-langlink",
      "ja": "コーシー＝シュワルツの不等式",
      "en": "Cauchy–Schwarz inequality"
    },
    {
      "type": "reference",
      "title": "W. Keith Nicholson, Linear Algebra with Applications (Lyryx, 2021A)",
      "url": "https://openlibrary-repo.ecampusontario.ca/jspui/bitstream/123456789/897/2/Nicholson-OpenLAWA-2021A.pdf",
      "note": "5.3 Orthogonality（Theorem 5.3.2 Cauchy Inequality）・10.1 Inner Products and Norms（Theorem 10.1.4 Cauchy-Schwarz Inequality）・Exercise 4.2.44（the Cauchy-Schwarz inequality）"
    },
    {
      "type": "textbook",
      "title": "OpenStax Calculus Volume 3",
      "note": "2.3 The Dot Product"
    }
  ],
  "confidence": "verified",
  "reviewed": {
    "machine": "2026-09-24",
    "audit": "2026-10-09",
    "human": null
  },
  "updated": "2026-10-09",
  "evidence": {
    "sources": [],
    "counted": "2026-09-27"
  },
  "flags": [
    {
      "code": "corpus-human-settled",
      "note": "見出しは人間が決めた（2026-09-25。docs/DECISIONS.md「Phase 2 統計・ベクトルの単元の前の修正」の、残った ③ を人間が決めた行）。register は主張しない。",
      "raised": "2026-09-25"
    }
  ]
}
