{
  "id": "limit-definition-of-the-derivative",
  "ja": {
    "term": "導関数の定義",
    "reading": "どうかんすうのていぎ",
    "alt": []
  },
  "en": {
    "term": "definition of the derivative",
    "alt": [],
    "uk": null,
    "register": "both"
  },
  "pos": "noun",
  "mapping": "exact",
  "mapping_note": null,
  "domains": [
    "calculus"
  ],
  "level": {
    "jp": [
      "数II",
      "数III"
    ],
    "us": [
      "AP Calculus AB",
      "Calculus I"
    ]
  },
  "definition_ja": "導関数を f′(x) = lim_{h→0} (f(x + h) − f(x))/h で定めること、またその式。",
  "definition_en": "Defining the derivative as f′(x) = lim_{h→0} (f(x + h) − f(x))/h, or that formula itself.",
  "latex": "f'(x) = \\lim_{h \\to 0} \\frac{f(x+h) - f(x)}{h}",
  "spoken_en": "f prime of x equals the limit as h approaches zero of f of x plus h minus f of x, over h",
  "examples": [
    {
      "en": "Use the definition of the derivative here, not the power rule.",
      "ja": "ここでは xⁿ の微分の公式ではなく、導関数の定義を使う。",
      "register": "spoken"
    },
    {
      "en": "Use the definition of the derivative to find f′(x) for f(x) = x².",
      "ja": "導関数の定義に従って、f(x) = x² の f′(x) を求めよ。",
      "register": "written"
    }
  ],
  "collocations": [],
  "pitfalls": [
    "OpenStax Calculus は limit definition of the derivative とも書く。(f(x + h) − f(x))/h の部分は difference quotient（差分商）と呼ぶ。"
  ],
  "related": [
    "derivative",
    "derivative-at-a-point",
    "limit",
    "average-rate-of-change"
  ],
  "sources": [
    {
      "type": "textbook",
      "title": "OpenStax Calculus Volume 1"
    },
    {
      "type": "reference",
      "title": "College Board, AP Calculus AB and BC Course and Exam Description (Effective Fall 2020)",
      "url": "https://apcentral.collegeboard.org/media/pdf/ap-calculus-ab-and-bc-course-and-exam-description.pdf",
      "note": "Topic 2.1（definition of the derivative）"
    }
  ],
  "confidence": "verified",
  "reviewed": {
    "machine": "2026-09-24",
    "audit": "2026-09-26",
    "human": null
  },
  "updated": "2026-09-26",
  "evidence": {
    "spoken": {
      "definition of the derivative": 33
    },
    "written": {
      "definition of the derivative": 29
    },
    "sources": [
      "khan-ap-calc",
      "mit-18.01",
      "mit-notes",
      "openstax-calculus",
      "openstax-precalculus",
      "yt:3blue1brown",
      "yt:nancypi",
      "yt:organicchem",
      "yt:patrickjmt"
    ],
    "counted": "2026-09-25"
  }
}
